<?xml version="1.0" standalone="no"?>

<!DOCTYPE caldavtest SYSTEM "caldavtest.dtd">

<!--
 Copyright (c) 2006-2013 Apple Inc. All rights reserved.

 Licensed under the Apache License, Version 2.0 (the "License");
 you may not use this file except in compliance with the License.
 You may obtain a copy of the License at

  http://www.apache.org/licenses/LICENSE-2.0

 Unless required by applicable law or agreed to in writing, software
 distributed under the License is distributed on an "AS IS" BASIS,
 WITHOUT WARRANTIES OR CONDITIONS OF ANY KIND, either express or implied.
 See the License for the specific language governing permissions and
 limitations under the License.
 -->

<caldavtest>
	<description>Test addressbook sharing replies</description>

	<require-feature>
		<feature>carddav</feature>
		<feature>shared-addressbooks</feature>
	</require-feature>

	<start>
		<request user="$useradmin:" pswd="$pswdadmin:">
			<method>DELETEALL</method>
			<ruri>$addressbookhome1:/</ruri>
			<ruri>$addressbookhome2:/</ruri>
			<ruri>$notificationpath1:/</ruri>
			<ruri>$notificationpath2:/</ruri>
		</request>
	</start>
	
	<test-suite name='Send first reply' ignore='no'>
		<test name='1' ignore='no'>
			<description>POST invitation</description>
			<request print-response='no'>
				<method>POST</method>
				<ruri>$addressbookpath1:/</ruri>
				<data>
					<content-type>text/xml; charset=utf-8</content-type>
					<filepath>Resource/CardDAV/sharing/replies/accept/1.xml</filepath>
				</data>
				<verify>
					<callback>statusCode</callback>
				</verify>
			</request>
		</test>
		<test name='2'>
			<description>Check Sharee notification collection</description>
			<request user="$userid2:" pswd="$pswd2:" print-response='no'>
				<method>WAITCOUNT 1</method>
				<ruri>$notificationpath2:/</ruri>
			</request>
			<request user="$userid2:" pswd="$pswd2:" print-response='no'>
				<method>GETNEW</method>
				<ruri>$notificationpath2:/</ruri>
				<verify>
					<callback>xmlDataMatch</callback>
					<arg>
						<name>filepath</name>
						<value>Resource/CardDAV/sharing/replies/accept/2.xml</value>
					</arg>
					<arg>
						<name>filter</name>
						<value>{http://calendarserver.org/ns/}dtstamp</value>
						<value>{http://calendarserver.org/ns/}uid</value>
					</arg>
				</verify>
				<grabelement>
					<name>{http://calendarserver.org/ns/}invite-notification/{http://calendarserver.org/ns/}uid</name>
					<variable>$inviteuid:</variable>
				</grabelement>
			</request>
		</test>
		<test name='3'>
			<description>Sharee replies ACCEPTED</description>
			<request user="$userid2:" pswd="$pswd2:" print-response='no'>
				<method>POST</method>
				<ruri>$addressbookhome2:/</ruri>
				<data substitutions='yes'>
					<content-type>application/xml; charset=utf-8</content-type>
					<filepath>Resource/CardDAV/sharing/replies/accept/3.xml</filepath>
				</data>
				<verify>
					<callback>xmlDataMatch</callback>
					<arg>
						<name>filepath</name>
						<value>Resource/CardDAV/sharing/replies/accept/7.xml</value>
					</arg>
					<arg>
						<name>filter</name>
						<value>{DAV:}href</value>
					</arg>
				</verify>
				<grabelement>
					<name>{DAV:}href</name>
					<variable>$shareeaddressbook:</variable>
				</grabelement>
			</request>
		</test>
		<test name='4' ignore='no'>
			<description>Check accept status</description>
			<request print-response='no'>
				<method>PROPFIND</method>
				<ruri>$addressbookpath1:/</ruri>
				<header>
					<name>Depth</name>
					<value>0</value>
				</header>
				<data>
					<content-type>text/xml; charset=utf-8</content-type>
					<filepath>Resource/CardDAV/sharing/replies/accept/4.xml</filepath>
				</data>
				<verify>
					<callback>xmlDataMatch</callback>
					<arg>
						<name>filepath</name>
						<value>Resource/CardDAV/sharing/replies/accept/5.xml</value>
					</arg>
					<arg>
						<name>filter</name>
						<value>{http://calendarserver.org/ns/}uid</value>
					</arg>
				</verify>
			</request>
		</test>
		<test name='5'>
			<description>Check Sharer notification collection</description>
			<request>
				<method>WAITCOUNT 1</method>
				<ruri>$notificationpath1:/</ruri>
			</request>
			<request print-response='no'>
				<method>GETNEW</method>
				<ruri>$notificationpath1:/</ruri>
				<verify>
					<callback>xmlDataMatch</callback>
					<arg>
						<name>filepath</name>
						<value>Resource/CardDAV/sharing/replies/accept/6.xml</value>
					</arg>
					<arg>
						<name>filter</name>
						<value>{http://calendarserver.org/ns/}dtstamp</value>
					</arg>
				</verify>
			</request>
		</test>
		<test name='6' ignore='no'>
			<description>Check sharee addressbook displayname/shared-url</description>
			<request user="$userid2:" pswd="$pswd2:" print-response='no'>
				<method>PROPFIND</method>
				<ruri>$shareeaddressbook:/</ruri>
				<header>
					<name>Depth</name>
					<value>0</value>
				</header>
				<data>
					<content-type>text/xml; charset=utf-8</content-type>
					<filepath>Resource/CardDAV/sharing/replies/accept/8.xml</filepath>
				</data>
				<verify>
					<callback>propfindValues</callback>
					<arg>
						<name>okprops</name>
						<value>{DAV:}displayname$My Shared Address Book</value>
						<value>{http://calendarserver.org/ns/}sharedurl$$calendarhome1:/shared</value>
					</arg>
				</verify>
			</request>
		</test>
		<test name='7' ignore='no'>
			<description>Check sharer addressbook displyname</description>
			<request print-response='no'>
				<method>PROPFIND</method>
				<ruri>$addressbookpath1:/</ruri>
				<header>
					<name>Depth</name>
					<value>0</value>
				</header>
				<data>
					<content-type>text/xml; charset=utf-8</content-type>
					<filepath>Resource/Common/PROPFIND/displayname.xml</filepath>
				</data>
				<verify>
					<callback>propfindItems</callback>
					<arg>
						<name>badprops</name>
						<value>{DAV:}displayname</value>
					</arg>
				</verify>
			</request>
		</test>
	</test-suite>
	
	<test-suite name='Update reply' ignore='no'>
		<test name='1'>
			<description>Sharee replies DECLINED</description>
			<request user="$userid2:" pswd="$pswd2:" print-response='no'>
				<method>POST</method>
				<ruri>$addressbookhome2:/</ruri>
				<data substitutions='yes'>
					<content-type>application/xml; charset=utf-8</content-type>
					<filepath>Resource/CardDAV/sharing/replies/decline/1.xml</filepath>
				</data>
				<verify>
					<callback>statusCode</callback>
				</verify>
			</request>
		</test>
		<test name='2' ignore='no'>
			<description>Check declined status</description>
			<request print-response='no'>
				<method>PROPFIND</method>
				<ruri>$addressbookpath1:/</ruri>
				<header>
					<name>Depth</name>
					<value>0</value>
				</header>
				<data>
					<content-type>text/xml; charset=utf-8</content-type>
					<filepath>Resource/CardDAV/sharing/replies/decline/2.xml</filepath>
				</data>
				<verify>
					<callback>xmlDataMatch</callback>
					<arg>
						<name>filepath</name>
						<value>Resource/CardDAV/sharing/replies/decline/3.xml</value>
					</arg>
					<arg>
						<name>filter</name>
						<value>{http://calendarserver.org/ns/}uid</value>
					</arg>
				</verify>
			</request>
		</test>
		<test name='3'>
			<description>Check Sharer notification collection</description>
			<request>
				<method>WAITCOUNT 1</method>
				<ruri>$notificationpath1:/</ruri>
			</request>
			<request print-response='no'>
				<method>GETNEW</method>
				<ruri>$notificationpath1:/</ruri>
				<verify>
					<callback>xmlDataMatch</callback>
					<arg>
						<name>filepath</name>
						<value>Resource/CardDAV/sharing/replies/decline/4.xml</value>
					</arg>
					<arg>
						<name>filter</name>
						<value>{http://calendarserver.org/ns/}dtstamp</value>
					</arg>
				</verify>
			</request>
		</test>
	</test-suite>
	
	<end>
		<request user="$useradmin:" pswd="$pswdadmin:">
			<method>DELETEALL</method>
			<ruri>$addressbookhome1:/</ruri>
			<ruri>$addressbookhome2:/</ruri>
			<ruri>$notificationpath1:/</ruri>
			<ruri>$notificationpath2:/</ruri>
		</request>
	</end>

</caldavtest>
