<?xml version="1.0" standalone="no"?>

<!DOCTYPE caldavtest SYSTEM "caldavtest.dtd">

<!--
 Copyright (c) 2006-2013 Apple Inc. All rights reserved.

 Licensed under the Apache License, Version 2.0 (the "License");
 you may not use this file except in compliance with the License.
 You may obtain a copy of the License at

  http://www.apache.org/licenses/LICENSE-2.0

 Unless required by applicable law or agreed to in writing, software
 distributed under the License is distributed on an "AS IS" BASIS,
 WITHOUT WARRANTIES OR CONDITIONS OF ANY KIND, either express or implied.
 See the License for the specific language governing permissions and
 limitations under the License.
 -->

<caldavtest>
	<description>Test proxy authorization on the server</description>

	<require-feature>
		<feature>caldav</feature>
		<feature>proxy-authz</feature>
	</require-feature>

	<start>
		<request end-delete="yes">
			<method>PUT</method>
			<ruri>$calendarpath1:/1.ics</ruri>
			<data>
				<content-type>text/calendar; charset=utf-8</content-type>
				<filepath>Resource/CalDAV/delete/1.txt</filepath>
			</data>
		</request>
		<request user="$userid2:" pswd="$pswd2:">
			<method>MKCALENDAR</method>
			<ruri>$calendarhome2:/visibletouser01/</ruri>
		</request>
		<request user="$userid2:" pswd="$pswd2:">
			<method>ACL</method>
			<ruri>$calendarhome2:/visibletouser01/</ruri>
			<data>
				<content-type>text/xml; charset=utf-8</content-type>
				<filepath>Resource/CalDAV/acls/3.xml</filepath>
			</data>
		</request>
		<request user="$userid2:" pswd="$pswd2:">
			<method>PUT</method>
			<ruri>$calendarhome2:/visibletouser01/hidden1.ics</ruri>
			<data>
				<content-type>text/calendar; charset=utf-8</content-type>
				<filepath>Resource/CalDAV/acls/16.ics</filepath>
			</data>
		</request>
		<request user="$userid2:" pswd="$pswd2:">
			<method>PUT</method>
			<ruri>$calendarhome2:/visibletouser01/visible2.ics</ruri>
			<data>
				<content-type>text/calendar; charset=utf-8</content-type>
				<filepath>Resource/CalDAV/acls/17.ics</filepath>
			</data>
		</request>
		<request user="$userid2:" pswd="$pswd2:">
			<method>MKCALENDAR</method>
			<ruri>$calendarhome2:/notvisibletouser01/</ruri>
		</request>
		<request user="$userid2:" pswd="$pswd2:">
			<method>ACL</method>
			<ruri>$calendarhome2:/notvisibletouser01/</ruri>
			<data>
				<content-type>text/xml; charset=utf-8</content-type>
				<filepath>Resource/CalDAV/acls/21.xml</filepath>
			</data>
		</request>
		<request user="$userid2:" pswd="$pswd2:">
			<method>PUT</method>
			<ruri>$calendarhome2:/notvisibletouser01/hidden1.ics</ruri>
			<data>
				<content-type>text/calendar; charset=utf-8</content-type>
				<filepath>Resource/CalDAV/acls/16.ics</filepath>
			</data>
		</request>
	</start>
	
	<test-suite name='Valid Proxy User' ignore='no'>
		<test name='1' ignore='no'>
			<description>GET user01 resource</description>
			<request user="$userproxy:" pswd="$pswdproxy:" print-response='no'>
				<method>GET</method>
				<ruri>$calendarpath1:/1.ics</ruri>
				<header>
					<name>X-Authorize-As</name>
					<value>$userid1:</value>
				</header>
				<verify>
					<callback>statusCode</callback>
				</verify>
			</request>
		</test>
		<test name='2' ignore='no'>
			<description>GET user02 resource</description>
			<request user="$userproxy:" pswd="$pswdproxy:" print-response='no'>
				<method>GET</method>
				<ruri>$calendarhome2:/visibletouser01/visible2.ics</ruri>
				<header>
					<name>X-Authorize-As</name>
					<value>$userid1:</value>
				</header>
				<verify>
					<callback>statusCode</callback>
				</verify>
			</request>
		</test>
		<test name='3' ignore='no'>
			<require-feature>
				<feature>per-object-ACLs</feature>
			</require-feature>
			<description>GET user02 resource</description>
			<request user="$userid2:" pswd="$pswd2:">
				<method>ACL</method>
				<ruri>$calendarhome2:/visibletouser01/hidden1.ics</ruri>
				<data>
					<content-type>text/xml; charset=utf-8</content-type>
					<filepath>Resource/CalDAV/acls/20.xml</filepath>
				</data>
			</request>
			<request user="$userproxy:" pswd="$pswdproxy:" print-response='no'>
				<method>GET</method>
				<ruri>$calendarhome2:/visibletouser01/hidden1.ics</ruri>
				<header>
					<name>X-Authorize-As</name>
					<value>$userid1:</value>
				</header>
				<verify>
					<callback>statusCode</callback>
					<arg>
						<name>status</name>
						<value>403</value>
					</arg>
				</verify>
			</request>
		</test>
		<test name='4' ignore='no'>
			<description>GET user02 resource</description>
			<request user="$userproxy:" pswd="$pswdproxy:" print-response='no'>
				<method>GET</method>
				<ruri>$calendarhome2:/notvisibletouser01/hidden1.ics</ruri>
				<header>
					<name>X-Authorize-As</name>
					<value>$userid1:</value>
				</header>
				<verify>
					<callback>statusCode</callback>
					<arg>
						<name>status</name>
						<value>403</value>
					</arg>
				</verify>
			</request>
		</test>
	</test-suite>

	<test-suite name='Wrong Proxy User' ignore='no'>
		<test name='1' ignore='no'>
			<description>GET user01 resource</description>
			<request user="$userproxy:" pswd="$pswdproxy:" print-response='no'>
				<method>GET</method>
				<ruri>$calendarpath1:/1.ics</ruri>
				<header>
					<name>X-Authorize-As</name>
					<value>$userid3:</value>
				</header>
				<verify>
					<callback>statusCode</callback>
					<arg>
						<name>status</name>
						<value>403</value>
					</arg>
				</verify>
			</request>
		</test>
		<test name='2' ignore='no'>
			<require-feature>
				<feature>per-object-ACLs</feature>
			</require-feature>
			<description>GET user02 resource</description>
			<request user="$userproxy:" pswd="$pswdproxy:" print-response='no'>
				<method>GET</method>
				<ruri>$calendarhome2:/visibletouser01/visible2.ics</ruri>
				<header>
					<name>X-Authorize-As</name>
					<value>$userid3:</value>
				</header>
				<verify>
					<callback>statusCode</callback>
					<arg>
						<name>status</name>
						<value>403</value>
					</arg>
				</verify>
			</request>
		</test>
		<test name='3' ignore='no'>
			<require-feature>
				<feature>per-object-ACLs</feature>
			</require-feature>
			<description>GET user02 resource</description>
			<request user="$userproxy:" pswd="$pswdproxy:" print-response='no'>
				<method>GET</method>
				<ruri>$calendarhome2:/visibletouser01/hidden1.ics</ruri>
				<header>
					<name>X-Authorize-As</name>
					<value>$userid3:</value>
				</header>
				<verify>
					<callback>statusCode</callback>
				</verify>
			</request>
		</test>
		<test name='4' ignore='no'>
			<require-feature>
				<feature>per-object-ACLs</feature>
			</require-feature>
			<description>GET user02 resource</description>
			<request user="$userproxy:" pswd="$pswdproxy:" print-response='no'>
				<method>GET</method>
				<ruri>$calendarhome2:/notvisibletouser01/hidden1.ics</ruri>
				<header>
					<name>X-Authorize-As</name>
					<value>$userid3:</value>
				</header>
				<verify>
					<callback>statusCode</callback>
					<arg>
						<name>status</name>
						<value>403</value>
					</arg>
				</verify>
			</request>
		</test>
	</test-suite>

	<test-suite name='Invalid Proxy User' ignore='no'>
		<test name='1' ignore='no'>
			<description>Valid proxy without header</description>
			<request user="$userproxy:" pswd="$pswdproxy:" print-response='no'>
				<method>GET</method>
				<ruri>$calendarpath1:/1.ics</ruri>
				<verify>
					<callback>statusCode</callback>
					<arg>
						<name>status</name>
						<value>400</value>
					</arg>
				</verify>
			</request>
		</test>
		<test name='2' ignore='no'>
			<description>Valid proxy proxying as another proxy</description>
			<request user="$userproxy:" pswd="$pswdproxy:" print-response='no'>
				<method>GET</method>
				<ruri>$calendarhome2:/visibletouser01/visible2.ics</ruri>
				<header>
					<name>X-Authorize-As</name>
					<value>proxy2</value>
				</header>
				<verify>
					<callback>statusCode</callback>
					<arg>
						<name>status</name>
						<value>403</value>
					</arg>
				</verify>
			</request>
		</test>
		<test name='3' ignore='no'>
			<description>Regular user trying to proxy</description>
			<request print-response='no'>
				<method>GET</method>
				<ruri>$calendarhome2:/visibletouser01/visible2.ics</ruri>
				<header>
					<name>X-Authorize-As</name>
					<value>$userid2:</value>
				</header>
				<verify>
					<callback>statusCode</callback>
					<arg>
						<name>status</name>
						<value>403</value>
					</arg>
				</verify>
			</request>
		</test>
	</test-suite>

	<end>
		<request user="$userid2:" pswd="$pswd2:">
			<method>DELETE</method>
			<ruri>$calendarhome2:/visibletouser01/</ruri>
		</request>
		<request user="$userid2:" pswd="$pswd2:">
			<method>DELETE</method>
			<ruri>$calendarhome2:/notvisibletouser01/</ruri>
		</request>
	</end>
	
</caldavtest>
