<?xml version="1.0" standalone="no"?>

<!DOCTYPE caldavtest SYSTEM "caldavtest.dtd">

<!--
 Copyright (c) 2006-2013 Apple Inc. All rights reserved.

 Licensed under the Apache License, Version 2.0 (the "License");
 you may not use this file except in compliance with the License.
 You may obtain a copy of the License at

  http://www.apache.org/licenses/LICENSE-2.0

 Unless required by applicable law or agreed to in writing, software
 distributed under the License is distributed on an "AS IS" BASIS,
 WITHOUT WARRANTIES OR CONDITIONS OF ANY KIND, either express or implied.
 See the License for the specific language governing permissions and
 limitations under the License.
 -->

<caldavtest>
	<description>Test implicit scheduling options in CalDAV</description>

	<require-feature>
		<feature>caldav</feature>
		<feature>implicit-scheduling</feature>
	</require-feature>

	<start/>
	
	<test-suite name='OPTIONS header' ignore='no'>
		<test name='1'>
			<description>Look for options header tag on principal</description>
			<request print-response="no">
				<method>OPTIONS</method>
				<ruri>$principal1:</ruri>
				<verify>
					<callback>header</callback>
					<arg>
						<name>header</name>
						<value>*DAV$.*calendar-access.*</value>
						<value>*DAV$.*calendar-schedule.*</value>
						<value>*DAV$.*calendar-auto-schedule.*</value>
					</arg>
				</verify>
			</request>
		</test>
		<test name='2'>
			<description>Look for options header tag on calendar</description>
			<request print-response="no">
				<method>OPTIONS</method>
				<ruri>$calendarpath1:/</ruri>
				<verify>
					<callback>header</callback>
					<arg>
						<name>header</name>
						<value>*DAV$.*calendar-access.*</value>
						<value>*DAV$.*calendar-schedule.*</value>
						<value>*DAV$.*calendar-auto-schedule.*</value>
					</arg>
				</verify>
			</request>
		</test>
	</test-suite>
	
	<end/>
	
</caldavtest>
