<?xml version="1.0" standalone="no"?>

<!DOCTYPE caldavtest SYSTEM "caldavtest.dtd">

<!--
 Copyright (c) 2006-2013 Apple Inc. All rights reserved.

 Licensed under the Apache License, Version 2.0 (the "License");
 you may not use this file except in compliance with the License.
 You may obtain a copy of the License at

  http://www.apache.org/licenses/LICENSE-2.0

 Unless required by applicable law or agreed to in writing, software
 distributed under the License is distributed on an "AS IS" BASIS,
 WITHOUT WARRANTIES OR CONDITIONS OF ANY KIND, either express or implied.
 See the License for the specific language governing permissions and
 limitations under the License.
 -->

<caldavtest>
	<description>Test implicit scheduling for multiple auto-accept locations</description>

	<require-feature>
		<feature>caldav</feature>
		<feature>auto-accept</feature>
		<feature>implicit-scheduling</feature>
	</require-feature>

	<start>
		<request user="$userid1:" pswd="$pswd1:">
			<method>GET</method>
			<ruri>$calendarpath1:/</ruri>
		</request>
		<request user="$userid2:" pswd="$pswd2:">
			<method>GET</method>
			<ruri>$calendarpath2:/</ruri>
		</request>
		<request>
			<method>DELETEALL</method>
			<ruri>$inboxpath1:/</ruri>
		</request>
		<request user="$userid2:" pswd="$pswd2:">
			<method>DELETEALL</method>
			<ruri>$inboxpath2:/</ruri>
		</request>
		<request user="$useradmin:" pswd="$pswdadmin:">
			<method>DELETEALL</method>
			<ruri>$rinboxpath1:/</ruri>
		</request>
		<request user="$useradmin:" pswd="$pswdadmin:">
			<method>DELETEALL</method>
			<ruri>$rcalendarpath1:/</ruri>
		</request>
	</start>
	
	<test-suite name='#1 Non-recurring without conflict' ignore='no'>
		<test name='1' ignore='no'>
			<description>Create new event</description>
			<request>
				<method>PUT</method>
				<ruri>$calendarpath1:/1.ics</ruri>
				<data>
					<content-type>text/calendar; charset=utf-8</content-type>
					<filepath>Resource/CalDAV/implicit/automultiple/suite1/1.ics</filepath>
				</data>
				<verify>
					<callback>statusCode</callback>
				</verify>
			</request>
		</test>
		<test name='2' ignore='no'>
			<description>Two items in user01 Inbox</description>
			<request print-response="no">
				<method>WAITDELETEALL 2</method>
				<ruri>$inboxpath1:/</ruri>
			</request>
		</test>
		<test name='3' ignore='no'>
			<description>One item in user01 Calendar</description>
			<request print-response="no">
				<method>GET</method>
				<ruri>$calendarpath1:/1.ics</ruri>
				<verify>
					<callback>calendarDataMatch</callback>
					<arg>
						<name>filepath</name>
						<value>Resource/CalDAV/implicit/automultiple/suite1/2.ics</value>
					</arg>
				</verify>
			</request>
		</test>
		<test name='4' ignore='no'>
			<description>One item in user02 Inbox</description>
			<request user="$useradmin:" pswd="$pswdadmin:" print-response="no">
				<method>WAITDELETEALL 1</method>
				<ruri>$inboxpath2:/</ruri>
			</request>
		</test>
		<test name='5' ignore='no'>
			<description>One item in user02 calendar</description>
			<request user="$useradmin:" pswd="$pswdadmin:" wait-for-success="yes" print-response="no">
				<method>GETNEW</method>
				<ruri>$calendarpath2:/</ruri>
				<verify>
					<callback>calendarDataMatch</callback>
					<arg>
						<name>filepath</name>
						<value>Resource/CalDAV/implicit/automultiple/suite1/3.ics</value>
					</arg>
				</verify>
			</request>
		</test>
		<test name='6' ignore='no'>
			<description>No items in resource01 Inbox</description>
			<request user="$useradmin:" pswd="$pswdadmin:" print-response="no">
				<method>PROPFIND</method>
				<ruri>$rinboxpath1:/</ruri>
				<header>
					<name>Depth</name>
					<value>1</value>
				</header>
				<data>
					<content-type>text/xml; charset=utf-8</content-type>
					<filepath>Resource/CalDAV/implicit/1.xml</filepath>
				</data>
				<verify>
					<callback>multistatusItems</callback>
					<arg>
						<name>count</name>
						<value>0</value>
					</arg>
				</verify>
			</request>
		</test>
		<test name='7' ignore='no'>
			<description>One item in resource01 Calendar</description>
			<request user="$useradmin:" pswd="$pswdadmin:" wait-for-success="yes" print-response="no">
				<method>GETNEW</method>
				<ruri>$rcalendarpath1:/</ruri>
				<verify>
					<callback>calendarDataMatch</callback>
					<arg>
						<name>filepath</name>
						<value>Resource/CalDAV/implicit/automultiple/suite1/4.ics</value>
					</arg>
					<arg>
						<name>filter</name>
						<value>ORGANIZER:SCHEDULE-STATUS</value>
					</arg>
				</verify>
			</request>
		</test>
		<test name='8' ignore='no'>
			<description>No items in resource02 Inbox</description>
			<request user="$useradmin:" pswd="$pswdadmin:" print-response="no">
				<method>PROPFIND</method>
				<ruri>$rinboxpath2:/</ruri>
				<header>
					<name>Depth</name>
					<value>1</value>
				</header>
				<data>
					<content-type>text/xml; charset=utf-8</content-type>
					<filepath>Resource/CalDAV/implicit/1.xml</filepath>
				</data>
				<verify>
					<callback>multistatusItems</callback>
					<arg>
						<name>count</name>
						<value>0</value>
					</arg>
				</verify>
			</request>
		</test>
		<test name='9' ignore='no'>
			<description>One item in resource02 Calendar</description>
			<request user="$useradmin:" pswd="$pswdadmin:" wait-for-success="yes" print-response="no">
				<method>GETNEW</method>
				<ruri>$rcalendarpath2:/</ruri>
				<verify>
					<callback>calendarDataMatch</callback>
					<arg>
						<name>filepath</name>
						<value>Resource/CalDAV/implicit/automultiple/suite1/4.ics</value>
					</arg>
					<arg>
						<name>filter</name>
						<value>ORGANIZER:SCHEDULE-STATUS</value>
					</arg>
				</verify>
			</request>
		</test>
		<test name='10' ignore='no'>
			<description>Clean-up inboxes</description>
			<request>
				<method>DELETEALL</method>
				<ruri>$inboxpath1:/</ruri>
			</request>
			<request user="$userid2:" pswd="$pswd2:">
				<method>DELETEALL</method>
				<ruri>$inboxpath2:/</ruri>
			</request>
			<request user="$useradmin:" pswd="$pswdadmin:">
				<method>DELETEALL</method>
				<ruri>$rinboxpath1:/</ruri>
			</request>
		</test>
	</test-suite>
	
	<end>
		<request>
			<method>DELETEALL</method>
			<ruri>$inboxpath1:/</ruri>
		</request>
		<request>
			<method>DELETEALL</method>
			<ruri>$calendarpath1:/</ruri>
		</request>
		<request user="$userid2:" pswd="$pswd2:">
			<method>DELETEALL</method>
			<ruri>$inboxpath2:/</ruri>
		</request>
		<request user="$useradmin:" pswd="$pswdadmin:">
			<method>DELETEALL</method>
			<ruri>$calendarpath2:/</ruri>
		</request>
		<request user="$useradmin:" pswd="$pswdadmin:">
			<method>DELETEALL</method>
			<ruri>$rinboxpath1:/</ruri>
		</request>
		<request user="$useradmin:" pswd="$pswdadmin:">
			<method>DELETEALL</method>
			<ruri>$rcalendarpath1:/</ruri>
		</request>
	</end>
	
</caldavtest>
