<?xml version="1.0" standalone="no"?>

<!DOCTYPE caldavtest SYSTEM "caldavtest.dtd">

<!--
 Copyright (c) 2012-2013 Apple Inc. All rights reserved.

 Licensed under the Apache License, Version 2.0 (the "License");
 you may not use this file except in compliance with the License.
 You may obtain a copy of the License at

  http://www.apache.org/licenses/LICENSE-2.0

 Unless required by applicable law or agreed to in writing, software
 distributed under the License is distributed on an "AS IS" BASIS,
 WITHOUT WARRANTIES OR CONDITIONS OF ANY KIND, either express or implied.
 See the License for the specific language governing permissions and
 limitations under the License.
 -->

<caldavtest>
	<description>Test managed attachments and quota</description>

	<require-feature>
		<feature>caldav</feature>
		<feature>managed-attachments</feature>
		<feature>prefer-representation</feature>
		<feature>quota</feature>
	</require-feature>

	<start/>
	
	<test-suite name='Simple non-recurring, non-scheduled add attachment no prefer'>
		<test name='1' ignore='no'>
			<description>Quota check</description>
			<request print-response='no'>
				<exclude-feature>
					<feature>quota-on-resources</feature>
				</exclude-feature>
				<method>PROPFIND</method>
				<ruri>$calendarhome1:/</ruri>
				<header>
					<name>Depth</name>
					<value>0</value>
				</header>
				<data>
					<content-type>text/xml; charset=utf-8</content-type>
					<filepath>Resource/CalDAV/managedattachments/quota/1.xml</filepath>
				</data>
				<verify>
					<callback>propfindItems</callback>
					<arg>
						<name>okprops</name>
						<value>{DAV:}resourcetype</value>
						<value>{DAV:}quota-available-bytes</value>
						<value>{DAV:}quota-used-bytes$0</value>
					</arg>
				</verify>
				<grabelement>
					<name>$verify-property-prefix:/{DAV:}quota-used-bytes</name>
					<variable>$quota1:</variable>
				</grabelement>
			</request>
		</test>
		<test name='2' ignore='no'>
			<description>PUT event</description>
			<request end-delete='no'>
				<method>PUT</method>
				<ruri>$calendarpath1:/1.ics</ruri>
				<data>
					<content-type>text/calendar; charset=utf-8</content-type>
					<filepath>Resource/CalDAV/managedattachments/quota/2.ics</filepath>
				</data>
				<verify>
					<callback>statusCode</callback>
				</verify>
			</request>
		</test>
		<test name='3' ignore='no'>
			<description>Quota check</description>
			<request print-response='no'>
				<exclude-feature>
					<feature>quota-on-resources</feature>
				</exclude-feature>
				<method>PROPFIND</method>
				<ruri>$calendarhome1:/</ruri>
				<header>
					<name>Depth</name>
					<value>0</value>
				</header>
				<data>
					<content-type>text/xml; charset=utf-8</content-type>
					<filepath>Resource/CalDAV/managedattachments/quota/1.xml</filepath>
				</data>
				<verify>
					<callback>propfindItems</callback>
					<arg>
						<name>okprops</name>
						<value>{DAV:}resourcetype</value>
						<value>{DAV:}quota-available-bytes</value>
						<value>{DAV:}quota-used-bytes$$quota1:</value>
					</arg>
				</verify>
			</request>
		</test>
		<test name='4' ignore='no'>
			<description>Add attachment</description>
			<request>
				<method>POST</method>
				<ruri>$calendarpath1:/1.ics?action=attachment-add</ruri>
				<header>
					<name>Content-Disposition</name>
					<value>attachment;filename=test.txt</value>
				</header>
				<header>
					<name>Prefer</name>
					<value>return=representation</value>
				</header>
				<data>
					<content-type>text/plain</content-type>
					<filepath>Resource/CalDAV/managedattachments/quota/3.txt</filepath>
				</data>
				<verify>
					<callback>dataString</callback>
					<arg>
						<name>unwrap</name>
						<value/>
					</arg>
					<arg>
						<name>contains</name>
						<value>ATTACH</value>
					</arg>
				</verify>
				<grabheader>
					<name>Cal-Managed-ID</name>
					<variable>$managed-id:</variable>
				</grabheader>
			</request>
		</test>
		<test name='5' ignore='no'>
			<description>Quota check</description>
			<request print-response='no'>
				<exclude-feature>
					<feature>quota-on-resources</feature>
				</exclude-feature>
				<method>PROPFIND</method>
				<ruri>$calendarhome1:/</ruri>
				<header>
					<name>Depth</name>
					<value>0</value>
				</header>
				<data>
					<content-type>text/xml; charset=utf-8</content-type>
					<filepath>Resource/CalDAV/managedattachments/quota/1.xml</filepath>
				</data>
				<verify>
					<callback>propfindItems</callback>
					<arg>
						<name>okprops</name>
						<value>{DAV:}resourcetype</value>
						<value>{DAV:}quota-available-bytes</value>
						<value>{DAV:}quota-used-bytes!$quota1:</value>
					</arg>
				</verify>
				<grabelement>
					<name>$verify-property-prefix:/{DAV:}quota-used-bytes</name>
					<variable>$quota2:</variable>
				</grabelement>
			</request>
		</test>
		<test name='6' ignore='no'>
			<description>Update attachment</description>
			<request>
				<method>POST</method>
				<ruri>$calendarpath1:/1.ics?action=attachment-update&amp;managed-id=$managed-id:</ruri>
				<header>
					<name>Content-Disposition</name>
					<value>attachment;filename=test2.txt</value>
				</header>
				<header>
					<name>Prefer</name>
					<value>return=representation</value>
				</header>
				<data>
					<content-type>text/plain</content-type>
					<filepath>Resource/CalDAV/managedattachments/quota/4.txt</filepath>
				</data>
				<verify>
					<callback>dataString</callback>
					<arg>
						<name>unwrap</name>
						<value/>
					</arg>
					<arg>
						<name>contains</name>
						<value>ATTACH</value>
						<value>;FILENAME=test2.txt</value>
						<value>;FMTTYPE=text/plain</value>
						<value>;SIZE=</value>
						<value>;MANAGED-ID=</value>
					</arg>
				</verify>
			</request>
		</test>
		<test name='7' ignore='no'>
			<description>Quota check</description>
			<request print-response='no'>
				<exclude-feature>
					<feature>quota-on-resources</feature>
				</exclude-feature>
				<method>PROPFIND</method>
				<ruri>$calendarhome1:/</ruri>
				<header>
					<name>Depth</name>
					<value>0</value>
				</header>
				<data>
					<content-type>text/xml; charset=utf-8</content-type>
					<filepath>Resource/CalDAV/managedattachments/quota/1.xml</filepath>
				</data>
				<verify>
					<callback>propfindItems</callback>
					<arg>
						<name>okprops</name>
						<value>{DAV:}resourcetype</value>
						<value>{DAV:}quota-available-bytes</value>
						<value>{DAV:}quota-used-bytes!$quota2:</value>
					</arg>
				</verify>
				<grabelement>
					<name>$verify-property-prefix:/{DAV:}quota-used-bytes</name>
					<variable>$quota3:</variable>
				</grabelement>
			</request>
		</test>
		<test name='8' ignore='no'>
			<description>Delete calendar data</description>
			<request>
				<method>DELETE</method>
				<ruri>$calendarpath1:/1.ics</ruri>
				<verify>
					<callback>statusCode</callback>
				</verify>
			</request>
		</test>
		<test name='9' ignore='no'>
			<description>Quota check</description>
			<request print-response='no'>
				<exclude-feature>
					<feature>quota-on-resources</feature>
				</exclude-feature>
				<method>PROPFIND</method>
				<ruri>$calendarhome1:/</ruri>
				<header>
					<name>Depth</name>
					<value>0</value>
				</header>
				<data>
					<content-type>text/xml; charset=utf-8</content-type>
					<filepath>Resource/CalDAV/managedattachments/quota/1.xml</filepath>
				</data>
				<verify>
					<callback>propfindItems</callback>
					<arg>
						<name>okprops</name>
						<value>{DAV:}resourcetype</value>
						<value>{DAV:}quota-available-bytes</value>
						<value>{DAV:}quota-used-bytes!$quota3:</value>
					</arg>
				</verify>
			</request>
		</test>
	</test-suite>

	<end/>

</caldavtest>
