<?xml version="1.0" standalone="no"?>

<!DOCTYPE caldavtest SYSTEM "caldavtest.dtd">

<!--
 Copyright (c) 2006-2013 Apple Inc. All rights reserved.

 Licensed under the Apache License, Version 2.0 (the "License");
 you may not use this file except in compliance with the License.
 You may obtain a copy of the License at

  http://www.apache.org/licenses/LICENSE-2.0

 Unless required by applicable law or agreed to in writing, software
 distributed under the License is distributed on an "AS IS" BASIS,
 WITHOUT WARRANTIES OR CONDITIONS OF ANY KIND, either express or implied.
 See the License for the specific language governing permissions and
 limitations under the License.
 -->

<caldavtest>
	<description>Test PUT method in CalDAV</description>

	<require-feature>
		<feature>caldav</feature>
		<feature>vpoll</feature>
	</require-feature>

	<start/>

	<test-suite name='supported-component-set'>
		<test name='1'>
			<require-feature>
				<feature>supported-component-sets</feature>
			</require-feature>
			<description>Check calendar home for property</description>
			<request>
				<method>PROPFIND</method>
				<ruri>$calendarhome1:/</ruri>
				<header>
					<name>Depth</name>
					<value>0</value>
				</header>
				<data>
					<content-type>text/xml; charset=utf-8</content-type>
					<filepath>Resource/CalDAV/polls/supported-component-set/1.xml</filepath>
				</data>
				<verify>
					<exclude-feature>
						<feature>supported-component-sets-one</feature>
					</exclude-feature>
					<callback>propfindItems</callback>
					<arg>
						<name>okprops</name>
						<value>{urn:ietf:params:xml:ns:caldav}supported-calendar-component-sets$</value>
					</arg>
				</verify>
				<verify>
					<require-feature>
						<feature>supported-component-sets-one</feature>
					</require-feature>
					<callback>xmlElementMatch</callback>
					<arg>
						<name>exists</name>
						<value>$verify-property-prefix:/{urn:ietf:params:xml:ns:caldav}supported-calendar-component-sets/{urn:ietf:params:xml:ns:caldav}supported-calendar-component-set/{urn:ietf:params:xml:ns:caldav}comp[@name="VEVENT"]</value>
						<value>$verify-property-prefix:/{urn:ietf:params:xml:ns:caldav}supported-calendar-component-sets/{urn:ietf:params:xml:ns:caldav}supported-calendar-component-set/{urn:ietf:params:xml:ns:caldav}comp[@name="VTODO"]</value>
						<value>$verify-property-prefix:/{urn:ietf:params:xml:ns:caldav}supported-calendar-component-sets/{urn:ietf:params:xml:ns:caldav}supported-calendar-component-set/{urn:ietf:params:xml:ns:caldav}comp[@name="VPOLL"]</value>
					</arg>
				</verify>
			</request>
		</test>
		<test name='2'>
			<description>Check calendar for property</description>
			<request>
				<method>PROPFIND</method>
				<ruri>$pollspath1:/</ruri>
				<header>
					<name>Depth</name>
					<value>0</value>
				</header>
				<data>
					<content-type>text/xml; charset=utf-8</content-type>
					<filepath>Resource/CalDAV/polls/supported-component-set/2.xml</filepath>
				</data>
				<verify>
					<require-feature>
						<feature>exclude-calendars</feature>
					</require-feature>
					<callback>xmlElementMatch</callback>
					<arg>
						<name>exists</name>
						<value>$verify-property-prefix:/{urn:ietf:params:xml:ns:caldav}supported-calendar-component-set/{urn:ietf:params:xml:ns:caldav}comp[@name="VEVENT"]</value>
						<value>$verify-property-prefix:/{urn:ietf:params:xml:ns:caldav}supported-calendar-component-set/{urn:ietf:params:xml:ns:caldav}comp[@name="VTODO"]</value>
						<value>$verify-property-prefix:/{urn:ietf:params:xml:ns:caldav}supported-calendar-component-set/{urn:ietf:params:xml:ns:caldav}comp[@name="VPOLL"]</value>
					</arg>
				</verify>
				<verify>
					<require-feature>
						<feature>split-calendars</feature>
					</require-feature>
					<callback>xmlElementMatch</callback>
					<arg>
						<name>exists</name>
						<value>$verify-property-prefix:/{urn:ietf:params:xml:ns:caldav}supported-calendar-component-set/{urn:ietf:params:xml:ns:caldav}comp[@name="VPOLL"]</value>
					</arg>
					<arg>
						<name>notexists</name>
						<value>$verify-property-prefix:/{urn:ietf:params:xml:ns:caldav}supported-calendar-component-set/{urn:ietf:params:xml:ns:caldav}comp[@name="VEVENT"]</value>
						<value>$verify-property-prefix:/{urn:ietf:params:xml:ns:caldav}supported-calendar-component-set/{urn:ietf:params:xml:ns:caldav}comp[@name="VTODO"]</value>
					</arg>
				</verify>
			</request>
		</test>
	</test-suite>

	<test-suite name='PUT VPOLL' ignore='no'>
		<test name='1' ignore='no'>
			<description>PUT unscheduled empty poll</description>
			<request end-delete='yes'>
				<method>PUT</method>
				<ruri>$pollspath1:/1.ics</ruri>
				<data>
					<content-type>text/calendar; charset=utf-8</content-type>
					<filepath>Resource/CalDAV/polls/put/1.ics</filepath>
				</data>
				<verify>
					<callback>statusCode</callback>
				</verify>
			</request>
			<request>
				<method>GET</method>
				<ruri>$pollspath1:/1.ics</ruri>
				<verify>
					<callback>calendarDataMatch</callback>
					<arg>
						<name>filepath</name>
						<value>Resource/CalDAV/polls/put/2.ics</value>
					</arg>
				</verify>
			</request>
		</test>
		<test name='2' ignore='no'>
			<description>PUT unscheduled event poll</description>
			<request end-delete='yes'>
				<method>PUT</method>
				<ruri>$pollspath1:/2.ics</ruri>
				<data>
					<content-type>text/calendar; charset=utf-8</content-type>
					<filepath>Resource/CalDAV/polls/put/3.ics</filepath>
				</data>
				<verify>
					<callback>statusCode</callback>
				</verify>
			</request>
			<request>
				<method>GET</method>
				<ruri>$pollspath1:/2.ics</ruri>
				<verify>
					<callback>calendarDataMatch</callback>
					<arg>
						<name>filepath</name>
						<value>Resource/CalDAV/polls/put/4.ics</value>
					</arg>
				</verify>
			</request>
		</test>
	</test-suite>
	
	<end/>
	
</caldavtest>
