<?xml version="1.0" standalone="no"?>

<!DOCTYPE caldavtest SYSTEM "caldavtest.dtd">

<!--
 Copyright (c) 2006-2013 Apple Inc. All rights reserved.

 Licensed under the Apache License, Version 2.0 (the "License");
 you may not use this file except in compliance with the License.
 You may obtain a copy of the License at

  http://www.apache.org/licenses/LICENSE-2.0

 Unless required by applicable law or agreed to in writing, software
 distributed under the License is distributed on an "AS IS" BASIS,
 WITHOUT WARRANTIES OR CONDITIONS OF ANY KIND, either express or implied.
 See the License for the specific language governing permissions and
 limitations under the License.
 -->

<caldavtest>
	<description>Simple podding test</description>

	<require-feature>
		<feature>caldav</feature>
		<feature>podding</feature>
	</require-feature>

	<start/>
	
	<test-suite name='Access principals via podA'>
		<test name='1'>
			<description>PROPFIND of user on podA as user on podA</description>
			<request>
				<method>PROPFIND</method>
				<ruri>$principal1:/</ruri>
				<header>
					<name>Depth</name>
					<value>0</value>
				</header>
				<data>
					<content-type>text/xml; charset=utf-8</content-type>
					<filepath>Resource/Common/PROPFIND/count.xml</filepath>
				</data>
				<verify>
					<callback>statusCode</callback>
				</verify>
			</request>
		</test>
		<test name='2'>
			<description>PROPFIND of user on podB as user on podA</description>
			<request>
				<method>PROPFIND</method>
				<ruri>$pprincipal1:/</ruri>
				<header>
					<name>Depth</name>
					<value>0</value>
				</header>
				<data>
					<content-type>text/xml; charset=utf-8</content-type>
					<filepath>Resource/Common/PROPFIND/count.xml</filepath>
				</data>
				<verify>
					<callback>statusCode</callback>
				</verify>
			</request>
		</test>
		<test name='3'>
			<description>PROPFIND of user on podA as user on podB</description>
			<request user='$puserid1:' pswd='$ppswd1:'>
				<method>PROPFIND</method>
				<ruri>$principal1:/</ruri>
				<header>
					<name>Depth</name>
					<value>0</value>
				</header>
				<data>
					<content-type>text/xml; charset=utf-8</content-type>
					<filepath>Resource/Common/PROPFIND/count.xml</filepath>
				</data>
				<verify>
					<callback>statusCode</callback>
				</verify>
			</request>
		</test>
		<test name='4'>
			<description>PROPFIND of user on podB as user on podB</description>
			<request user='$puserid1:' pswd='$ppswd1:'>
				<method>PROPFIND</method>
				<ruri>$pprincipal1:/</ruri>
				<header>
					<name>Depth</name>
					<value>0</value>
				</header>
				<data>
					<content-type>text/xml; charset=utf-8</content-type>
					<filepath>Resource/Common/PROPFIND/count.xml</filepath>
				</data>
				<verify>
					<callback>statusCode</callback>
				</verify>
			</request>
		</test>
	</test-suite>

	<test-suite name='Access principals via podB'>
		<test name='1'>
			<description>PROPFIND of user on podA as user on podA</description>
			<request host2='yes'>
				<method>PROPFIND</method>
				<ruri>$principal1:/</ruri>
				<header>
					<name>Depth</name>
					<value>0</value>
				</header>
				<data>
					<content-type>text/xml; charset=utf-8</content-type>
					<filepath>Resource/Common/PROPFIND/count.xml</filepath>
				</data>
				<verify>
					<callback>statusCode</callback>
				</verify>
			</request>
		</test>
		<test name='2'>
			<description>PROPFIND of user on podB as user on podA</description>
			<request host2='yes'>
				<method>PROPFIND</method>
				<ruri>$pprincipal1:/</ruri>
				<header>
					<name>Depth</name>
					<value>0</value>
				</header>
				<data>
					<content-type>text/xml; charset=utf-8</content-type>
					<filepath>Resource/Common/PROPFIND/count.xml</filepath>
				</data>
				<verify>
					<callback>statusCode</callback>
				</verify>
			</request>
		</test>
		<test name='3'>
			<description>PROPFIND of user on podA as user on podB</description>
			<request host2='yes' user='$puserid1:' pswd='$ppswd1:'>
				<method>PROPFIND</method>
				<ruri>$principal1:/</ruri>
				<header>
					<name>Depth</name>
					<value>0</value>
				</header>
				<data>
					<content-type>text/xml; charset=utf-8</content-type>
					<filepath>Resource/Common/PROPFIND/count.xml</filepath>
				</data>
				<verify>
					<callback>statusCode</callback>
				</verify>
			</request>
		</test>
		<test name='4'>
			<description>PROPFIND of user on podB as user on podB</description>
			<request host2='yes' user='$puserid1:' pswd='$ppswd1:'>
				<method>PROPFIND</method>
				<ruri>$pprincipal1:/</ruri>
				<header>
					<name>Depth</name>
					<value>0</value>
				</header>
				<data>
					<content-type>text/xml; charset=utf-8</content-type>
					<filepath>Resource/Common/PROPFIND/count.xml</filepath>
				</data>
				<verify>
					<callback>statusCode</callback>
				</verify>
			</request>
		</test>
	</test-suite>

	<test-suite name='Access calendar homes via podA'>
		<test name='1'>
			<description>PROPFIND of user on podA as user on podA</description>
			<request>
				<method>PROPFIND</method>
				<ruri>$calendarhome1:/</ruri>
				<header>
					<name>Depth</name>
					<value>0</value>
				</header>
				<data>
					<content-type>text/xml; charset=utf-8</content-type>
					<filepath>Resource/Common/PROPFIND/count.xml</filepath>
				</data>
				<verify>
					<callback>statusCode</callback>
				</verify>
			</request>
		</test>
		<test name='2'>
			<description>PROPFIND of user on podB as user on podA</description>
			<request>
				<method>PROPFIND</method>
				<ruri>$pcalendarhome1:/</ruri>
				<header>
					<name>Depth</name>
					<value>0</value>
				</header>
				<data>
					<content-type>text/xml; charset=utf-8</content-type>
					<filepath>Resource/Common/PROPFIND/count.xml</filepath>
				</data>
				<verify>
					<callback>statusCode</callback>
					<arg>
						<name>status</name>
						<value>403</value>
					</arg>
				</verify>
			</request>
		</test>
		<test name='3'>
			<description>PROPFIND of user on podA as user on podB</description>
			<request user='$puserid1:' pswd='$ppswd1:'>
				<method>PROPFIND</method>
				<ruri>$calendarhome1:/</ruri>
				<header>
					<name>Depth</name>
					<value>0</value>
				</header>
				<data>
					<content-type>text/xml; charset=utf-8</content-type>
					<filepath>Resource/Common/PROPFIND/count.xml</filepath>
				</data>
				<verify>
					<callback>statusCode</callback>
					<arg>
						<name>status</name>
						<value>403</value>
					</arg>
				</verify>
			</request>
		</test>
		<test name='4'>
			<description>PROPFIND of user on podB as user on podB</description>
			<request user='$puserid1:' pswd='$ppswd1:'>
				<method>PROPFIND</method>
				<ruri>$pcalendarhome1:/</ruri>
				<header>
					<name>Depth</name>
					<value>0</value>
				</header>
				<data>
					<content-type>text/xml; charset=utf-8</content-type>
					<filepath>Resource/Common/PROPFIND/count.xml</filepath>
				</data>
				<verify>
					<callback>statusCode</callback>
				</verify>
			</request>
		</test>
	</test-suite>

	<test-suite name='Access calendar homes via podB' only='yes'>
		<test name='1'>
			<description>PROPFIND of user on podA as user on podA</description>
			<request host2='yes'>
				<method>PROPFIND</method>
				<ruri>$calendarhome1:/</ruri>
				<header>
					<name>Depth</name>
					<value>0</value>
				</header>
				<data>
					<content-type>text/xml; charset=utf-8</content-type>
					<filepath>Resource/Common/PROPFIND/count.xml</filepath>
				</data>
				<verify>
					<callback>statusCode</callback>
				</verify>
			</request>
		</test>
		<test name='2'>
			<description>PROPFIND of user on podB as user on podA</description>
			<request host2='yes'>
				<method>PROPFIND</method>
				<ruri>$pcalendarhome1:/</ruri>
				<header>
					<name>Depth</name>
					<value>0</value>
				</header>
				<data>
					<content-type>text/xml; charset=utf-8</content-type>
					<filepath>Resource/Common/PROPFIND/count.xml</filepath>
				</data>
				<verify>
					<callback>statusCode</callback>
					<arg>
						<name>status</name>
						<value>403</value>
					</arg>
				</verify>
			</request>
		</test>
		<test name='3'>
			<description>PROPFIND of user on podA as user on podB</description>
			<request host2='yes' user='$puserid1:' pswd='$ppswd1:'>
				<method>PROPFIND</method>
				<ruri>$calendarhome1:/</ruri>
				<header>
					<name>Depth</name>
					<value>0</value>
				</header>
				<data>
					<content-type>text/xml; charset=utf-8</content-type>
					<filepath>Resource/Common/PROPFIND/count.xml</filepath>
				</data>
				<verify>
					<callback>statusCode</callback>
					<arg>
						<name>status</name>
						<value>403</value>
					</arg>
				</verify>
			</request>
		</test>
		<test name='4'>
			<description>PROPFIND of user on podB as user on podB</description>
			<request host2='yes' user='$puserid1:' pswd='$ppswd1:'>
				<method>PROPFIND</method>
				<ruri>$pcalendarhome1:/</ruri>
				<header>
					<name>Depth</name>
					<value>0</value>
				</header>
				<data>
					<content-type>text/xml; charset=utf-8</content-type>
					<filepath>Resource/Common/PROPFIND/count.xml</filepath>
				</data>
				<verify>
					<callback>statusCode</callback>
				</verify>
			</request>
		</test>
	</test-suite>

	<end/>
	
</caldavtest>
